<?xml version="1.0" encoding="UTF-8"?>
<!DOCTYPE CURSOS SYSTEM "DTD.dtd" >
<CURSOS>
   <SEMESTRE>
  <SEMESTRE/>
  <ESTUDIANTE>
    <CODIGO_EST>CODIGO_EST</CODIGO_EST>
    <NOMBRE_EST>NOMBRE_EST</NOMBRE_EST>
    <APELLIDO_EST>APELLIDO_EST</APELLIDO_EST>
    <CEDULA_EST>CEDULA_EST</CEDULA_EST>
  </ESTUDIANTE>
  <MATERIA>
    <CODIGO_MAT/>
    <NOMBRE_MAT>NOMBRE_MAT</NOMBRE_MAT>
    <DESCRIPCION_MAT>DESCRIPCION_MAT</DESCRIPCION_MAT>
    <CREDITOS_MAT>CREDITOS_MAT</CREDITOS_MAT>
  </MATERIA>
  <DOCENTE>
    <CODIGO_DOC>CODIGO_DOC</CODIGO_DOC>
    <NOMBRE_DOC>NOMBRE_DOC</NOMBRE_DOC>
    <APELLIDO_DOC>APELLIDO_DOC</APELLIDO_DOC>
    <CEDULA_DOC>CEDULA_DOC</CEDULA_DOC>
  </DOCENTE>
</CURSOS>
